"Update data from BnF via ISNI",integration-queries/update-person-org-authorities-bnf-isni.sparql
"Update data from BnF via VIAF",integration-queries/update-person-org-authorities-bnf-viaf.sparql
"Update data from Bnf via Wikidata",integration-queries/update-person-org-authorities-bnf-wikidata.sparql
"Update data from KBR via ISNI",integration-queries/update-person-org-authorities-kbr-isni.sparql
"Update data from KBR via VIAF",integration-queries/update-person-org-authorities-kbr-viaf.sparql
"Update data from KBR via Wikidata",integration-queries/update-person-org-authorities-kbr-wikidata.sparql
"Update data from KB (NTA) via ISNI",integration-queries/update-person-org-authorities-kb-isni.sparql
"Update data from KB (NTA) via VIAF",integration-queries/update-person-org-authorities-kb-viaf.sparql
"Update data from KB (NTA) via Wikidata",integration-queries/update-person-org-authorities-kb-wikidata.sparql
